{
  "schemaVersion": 1,
  "id": "ishioho-default",
  "title": "Ishioho second-floor home",
  "coordinateSystem": {
    "viewBox": [0, 0, 100, 50],
    "units": "diagram",
    "xAxis": "right",
    "yAxis": "down",
    "measured": false,
    "note": "Coordinates trace the illustrated 2:1 Stardew map and the homeowner's plan. They locate controls and express topology; they are not surveyed dimensions."
  },
  "levels": [
    {
      "id": "home",
      "number": 2,
      "label": "Second-floor home",
      "default": true,
      "footprint": [[22.5, 22], [28, 22], [28, 4.5], [52.3, 4.5], [52.3, 3], [73, 3], [73, 1], [92.4, 1], [92.4, 39.7], [22.5, 39.7]]
    },
    {
      "id": "garage",
      "number": 1,
      "label": "Single-car garage below",
      "default": false,
      "footprint": [[24, 29], [41, 29], [41, 46], [24, 46]]
    }
  ],
  "spaces": [
    {
      "id": "garage_stairs",
      "levelId": "home",
      "kind": "exterior_stair",
      "label": "Stairs to garage",
      "polygon": [[5, 22.5], [11, 22.5], [11, 44.5], [5, 44.5]],
      "anchor": [7.8, 31.5]
    },
    {
      "id": "porch",
      "levelId": "home",
      "kind": "covered_porch",
      "label": "Covered porch",
      "polygon": [[5, 17.7], [12.2, 17.7], [12.2, 19], [22.5, 19], [22.5, 27.5], [11, 27.5], [11, 22.5], [5, 22.5]],
      "anchor": [10.8, 18.75]
    },
    {
      "id": "balcony",
      "levelId": "home",
      "kind": "balcony",
      "label": "Plant balcony",
      "polygon": [[12.2, 4.5], [28, 4.5], [28, 22], [22.5, 19], [12.2, 19]],
      "anchor": [19.023, 14.12]
    },
    {
      "id": "entryway",
      "levelId": "home",
      "kind": "entry",
      "label": "Entry",
      "polygon": [[22.5, 22], [28.5, 22], [28.5, 31], [22.5, 31]],
      "anchor": [25.5, 27.5]
    },
    {
      "id": "living",
      "levelId": "home",
      "kind": "living_room",
      "label": "Living",
      "polygon": [[28, 4.5], [52.3, 4.5], [52.3, 22], [28, 22]],
      "anchor": [39.543, 14.737]
    },
    {
      "id": "office",
      "levelId": "home",
      "kind": "office",
      "label": "Office",
      "polygon": [[52.3, 3], [69.5, 3], [69.5, 22], [52.3, 22]],
      "anchor": [56.669, 12.886]
    },
    {
      "id": "closet",
      "levelId": "home",
      "kind": "closet",
      "label": "Closet",
      "polygon": [[69.5, 3], [73, 3], [73, 22], [69.5, 22]],
      "anchor": [71.25, 12.5]
    },
    {
      "id": "master",
      "levelId": "home",
      "kind": "bedroom",
      "label": "Bedroom",
      "polygon": [[73, 1], [92.4, 1], [92.4, 25.5], [73, 25.5]],
      "anchor": [76.417, 15.2]
    },
    {
      "id": "hall",
      "levelId": "home",
      "kind": "hallway",
      "label": "Hallway",
      "polygon": [[28.5, 22], [73, 22], [73, 25.5], [75, 25.5], [75, 29.2], [61.5, 29.2], [61.5, 24.8], [39.8, 24.8], [39.8, 25], [28.5, 25]],
      "anchor": [64.383, 23.994]
    },
    {
      "id": "dining",
      "levelId": "home",
      "kind": "dining_room",
      "label": "Dining",
      "polygon": [[28.5, 25], [39.8, 25], [39.8, 39.7], [22.5, 39.7], [22.5, 31], [28.5, 31]],
      "anchor": [28.974, 34.177]
    },
    {
      "id": "kitchen",
      "levelId": "home",
      "kind": "kitchen",
      "label": "Kitchen",
      "polygon": [[39.8, 24.8], [61.5, 24.8], [61.5, 39.7], [39.8, 39.7]],
      "anchor": [48.8, 32.635]
    },
    {
      "id": "guest_bath",
      "levelId": "home",
      "kind": "bathroom",
      "label": "Guest bath",
      "polygon": [[61.5, 29.2], [75, 29.2], [75, 39.7], [61.5, 39.7]],
      "anchor": [63.611, 37.726]
    },
    {
      "id": "bathroom",
      "levelId": "home",
      "kind": "bathroom",
      "label": "Primary bath",
      "polygon": [[75, 25.5], [92.4, 25.5], [92.4, 39.7], [75, 39.7]],
      "anchor": [76.417, 34.949]
    },
    {
      "id": "garage",
      "levelId": "garage",
      "kind": "single_car_garage",
      "label": "Garage",
      "polygon": [[24, 29], [41, 29], [41, 46], [24, 46]],
      "anchor": [32.5, 37.5]
    }
  ],
  "walls": [
    {"id": "home_west_entry", "levelId": "home", "kind": "exterior", "segment": [[22.5, 22], [22.5, 39.7]]},
    {"id": "home_north_entry", "levelId": "home", "kind": "exterior", "segment": [[22.5, 22], [28, 22]]},
    {"id": "home_west_living", "levelId": "home", "kind": "exterior", "segment": [[28, 4.5], [28, 22]]},
    {"id": "home_north_living", "levelId": "home", "kind": "exterior", "segment": [[28, 4.5], [52.3, 4.5]]},
    {"id": "home_north_office", "levelId": "home", "kind": "exterior", "segment": [[52.3, 3], [73, 3]]},
    {"id": "home_north_bedroom", "levelId": "home", "kind": "exterior", "segment": [[73, 1], [92.4, 1]]},
    {"id": "home_east", "levelId": "home", "kind": "exterior", "segment": [[92.4, 1], [92.4, 39.7]]},
    {"id": "home_south", "levelId": "home", "kind": "exterior", "segment": [[22.5, 39.7], [92.4, 39.7]]},
    {"id": "living_office", "levelId": "home", "kind": "interior", "segment": [[52.3, 4.5], [52.3, 22]]},
    {"id": "office_closet", "levelId": "home", "kind": "interior", "segment": [[69.5, 3], [69.5, 22]]},
    {"id": "closet_bedroom", "levelId": "home", "kind": "interior", "segment": [[73, 3], [73, 22]]},
    {"id": "office_hall", "levelId": "home", "kind": "interior", "segment": [[52.3, 22], [69.5, 22]]},
    {"id": "bedroom_hall", "levelId": "home", "kind": "interior", "segment": [[73, 22], [73, 25.5]]},
    {"id": "bedroom_bath", "levelId": "home", "kind": "interior", "segment": [[73, 25.5], [92.4, 25.5]]},
    {"id": "kitchen_dining", "levelId": "home", "kind": "interior", "segment": [[39.8, 25], [39.8, 39.7]]},
    {"id": "kitchen_hall", "levelId": "home", "kind": "interior", "segment": [[39.8, 24.8], [61.5, 24.8]]},
    {"id": "kitchen_guest_bath", "levelId": "home", "kind": "interior", "segment": [[61.5, 29.2], [61.5, 39.7]]},
    {"id": "guest_bath_hall", "levelId": "home", "kind": "interior", "segment": [[61.5, 29.2], [75, 29.2]]},
    {"id": "hall_primary_bath", "levelId": "home", "kind": "interior", "segment": [[75, 25.5], [75, 29.2]]},
    {"id": "guest_primary_bath", "levelId": "home", "kind": "interior", "segment": [[75, 29.2], [75, 39.7]]},
    {"id": "balcony_north", "levelId": "home", "kind": "parapet", "segment": [[12.2, 4.5], [28, 4.5]]},
    {"id": "balcony_west", "levelId": "home", "kind": "railing", "segment": [[12.2, 4.5], [12.2, 19]]},
    {"id": "balcony_south", "levelId": "home", "kind": "railing", "segment": [[12.2, 19], [22.5, 19]]},
    {"id": "balcony_south_east", "levelId": "home", "kind": "parapet", "segment": [[22.5, 19], [28, 22]]},
    {"id": "porch_west", "levelId": "home", "kind": "railing", "segment": [[5, 17.7], [5, 22.5]]},
    {"id": "porch_south", "levelId": "home", "kind": "railing", "segment": [[11, 27.5], [22.5, 27.5]]},
    {"id": "stair_guard", "levelId": "home", "kind": "railing", "segment": [[11, 27.5], [11, 44.5]]},
    {"id": "stair_outer_guard", "levelId": "home", "kind": "railing", "segment": [[5, 22.5], [5, 44.5]]},
    {"id": "garage_west", "levelId": "garage", "kind": "exterior", "segment": [[24, 29], [24, 46]]},
    {"id": "garage_north", "levelId": "garage", "kind": "exterior", "segment": [[24, 29], [41, 29]]},
    {"id": "garage_east", "levelId": "garage", "kind": "exterior", "segment": [[41, 29], [41, 46]]},
    {"id": "garage_south", "levelId": "garage", "kind": "exterior", "segment": [[24, 46], [41, 46]]}
  ],
  "openings": [
    {"id": "front_door", "levelId": "home", "kind": "door", "segment": [[22.5, 22.8], [22.5, 25.1]], "connects": ["porch", "entryway"]},
    {"id": "balcony_living_slider", "levelId": "home", "kind": "sliding_door", "segment": [[28, 10.5], [28, 16.5]], "connects": ["balcony", "living"]},
    {"id": "porch_balcony_gate", "levelId": "home", "kind": "gate", "segment": [[12.2, 17.7], [12.2, 19]], "connects": ["porch", "balcony"]},
    {"id": "porch_stair_gate", "levelId": "home", "kind": "gate", "segment": [[6, 22.5], [10, 22.5]], "connects": ["porch", "garage_stairs"]},
    {"id": "entry_hall_passage", "levelId": "home", "kind": "passage", "segment": [[28.5, 22.5], [28.5, 24.5]], "connects": ["entryway", "hall"]},
    {"id": "living_hall_passage", "levelId": "home", "kind": "passage", "segment": [[37, 22], [44.5, 22]], "connects": ["living", "hall"]},
    {"id": "office_door", "levelId": "home", "kind": "door", "segment": [[63, 22], [66, 22]], "connects": ["hall", "office"]},
    {"id": "closet_door", "levelId": "home", "kind": "door", "segment": [[73, 9.5], [73, 12]], "connects": ["master", "closet"]},
    {"id": "bedroom_door", "levelId": "home", "kind": "door", "segment": [[73, 22], [73, 25]], "connects": ["hall", "master"]},
    {"id": "dining_entry_passage", "levelId": "home", "kind": "passage", "segment": [[25.5, 31], [30.5, 31]], "connects": ["entryway", "dining"]},
    {"id": "kitchen_hall_passage", "levelId": "home", "kind": "passage", "segment": [[50, 24.8], [56, 24.8]], "connects": ["hall", "kitchen"]},
    {"id": "guest_bath_door", "levelId": "home", "kind": "door", "segment": [[64, 29.2], [66.5, 29.2]], "connects": ["hall", "guest_bath"]},
    {"id": "primary_bath_door", "levelId": "home", "kind": "door", "segment": [[78.5, 25.5], [81, 25.5]], "connects": ["master", "bathroom"]},
    {"id": "living_north_window", "levelId": "home", "kind": "window", "segment": [[36, 4.5], [45, 4.5]]},
    {"id": "office_north_window", "levelId": "home", "kind": "window", "segment": [[58.5, 3], [65.5, 3]]},
    {"id": "bedroom_north_window", "levelId": "home", "kind": "window", "segment": [[78.5, 1], [86.5, 1]]},
    {"id": "bedroom_east_window", "levelId": "home", "kind": "window", "segment": [[92.4, 11.5], [92.4, 18]]},
    {"id": "bath_east_window", "levelId": "home", "kind": "window", "segment": [[92.4, 30], [92.4, 35.5]]},
    {"id": "dining_south_window", "levelId": "home", "kind": "window", "segment": [[29.5, 39.7], [35, 39.7]]},